{
  "$schema": "./evidence-run.v1.schema.json",
  "schema_version": "1.0.0",
  "record_kind": "run",
  "run_id": "project-search-local-native-05a96adc",
  "run_scope": "capability_slice",
  "artifact_location_base": "evidence_run_directory",
  "schema_artifact_id": "project-search-evidence-schema",
  "desired_contract": {
    "path": "agi-stack/apps/desktop/contracts/desktop-web-parity/parity-manifest.v2.json",
    "path_base": "repository_root",
    "artifact_id": "project-search-desired-contract",
    "schema_version": "2.0.0",
    "revision": "05a96adc65c1cf31721c4c261e3b4d7f36358797",
    "sha256": "65dfbf0790aa965d8baab8599ed3757ec5b4159eda2701169810936419d539d2"
  },
  "source_revisions": {
    "repository_revision": "05a96adc65c1cf31721c4c261e3b4d7f36358797",
    "web_revision": "05a96adc65c1cf31721c4c261e3b4d7f36358797",
    "desktop_revision": "05a96adc65c1cf31721c4c261e3b4d7f36358797",
    "prototype_revision": "61454b2ead1cedda584e95afee9f471aac7851fb"
  },
  "source_state": {
    "head_revision": "05a96adc65c1cf31721c4c261e3b4d7f36358797",
    "worktree_state": "clean"
  },
  "started_at": "2026-07-30T08:28:00Z",
  "completed_at": "2026-07-30T08:49:07Z",
  "environment": {
    "host_os": "macOS",
    "host_os_version": "26.5.2",
    "architecture": "arm64",
    "execution_context": "local",
    "sandboxed": false,
    "locale": "zh-CN",
    "timezone": "Asia/Shanghai",
    "dependency_versions": {
      "node": "v22.22.3",
      "pnpm": "11.15.1",
      "rustc": "1.96.1 (31fca3adb 2026-06-26)",
      "electron": "43.2.0"
    }
  },
  "matched_state": {
    "locale": "zh-CN",
    "theme": "dark",
    "viewport": {
      "width": 1296,
      "height": 768
    },
    "device_scale_factor": 1,
    "authentication_state": "local_trusted_session",
    "account_state": "local_desktop",
    "permission_state": "authenticated_project_member",
    "data_state": "ready_degraded",
    "interaction_state": "native_deep_link_restore_search_and_structured_unavailable"
  },
  "capability_results": [
    {
      "capability_id": "project-project-search",
      "contract_reference": "agi-stack/apps/desktop/contracts/desktop-web-parity/parity-manifest.v2.json#project-project-search",
      "result": "blocked",
      "summary": "The clean-HEAD build, Desktop Browser matrix, Local sidecar authority, and native Local Project Search deep link were verified. The capability cannot pass because an authorized matched-state Web and Cloud Desktop Project Search session was unavailable.",
      "evidence": {
        "build": "passed",
        "browser": "blocked",
        "native": "blocked"
      },
      "artifact_ids": [
        "project-search-evidence-schema",
        "project-search-desired-contract",
        "project-search-build-report",
        "project-search-browser-blocker",
        "project-search-native-authority",
        "project-search-native-screenshot",
        "project-search-overview-screenshot"
      ],
      "parity_judgment": {
        "disposition": "pending_review",
        "statement": "Full Project Search equivalence remains pending until the same authorized Web and Cloud Desktop project state is retained alongside the Local native evidence.",
        "judgment_audit": null
      },
      "intentional_deviation": {
        "disposition": "none",
        "statement": null,
        "judgment_audit": null
      }
    }
  ],
  "artifacts": [
    {
      "artifact_id": "project-search-evidence-schema",
      "kind": "report",
      "channel": "shared",
      "evidence_roles": [
        "contract"
      ],
      "location": "evidence-run.v1.schema.json",
      "media_type": "application/schema+json",
      "sha256": "673ddd2b0fd38b97cbf71007fd2a6fe9692dc03ca11c74fc12f0254b24aaf0ed",
      "produced_at": "2026-07-30T08:48:34Z"
    },
    {
      "artifact_id": "project-search-desired-contract",
      "kind": "report",
      "channel": "shared",
      "evidence_roles": [
        "contract"
      ],
      "location": "parity-manifest.v2.json",
      "media_type": "application/json",
      "sha256": "65dfbf0790aa965d8baab8599ed3757ec5b4159eda2701169810936419d539d2",
      "produced_at": "2026-07-30T08:48:34Z"
    },
    {
      "artifact_id": "project-search-build-report",
      "kind": "report",
      "channel": "build",
      "evidence_roles": [
        "contract"
      ],
      "location": "build-report.json",
      "media_type": "application/json",
      "sha256": "275814b7d0c5d732d04c936a9adaea77df5094842f6f784863936f21e386b1e5",
      "produced_at": "2026-07-30T08:36:20Z"
    },
    {
      "artifact_id": "project-search-browser-blocker",
      "kind": "report",
      "channel": "browser",
      "evidence_roles": [
        "desktop_renderer",
        "observation_metadata"
      ],
      "location": "browser-blocker-report.json",
      "media_type": "application/json",
      "sha256": "79b606298cd6389b529636cbba6042e3953e791cd92cfa4107c7e2facbff8546",
      "produced_at": "2026-07-30T08:49:07Z"
    },
    {
      "artifact_id": "project-search-native-authority",
      "kind": "report",
      "channel": "native",
      "evidence_roles": [
        "native_electron",
        "sidecar_authority"
      ],
      "location": "native-authority-report.json",
      "media_type": "application/json",
      "sha256": "3c5984d163f7f81d735b418d375adf37fca13dcc0fb0ccca2c5956cd5bd14d57",
      "produced_at": "2026-07-30T08:49:07Z"
    },
    {
      "artifact_id": "project-search-native-screenshot",
      "kind": "screenshot",
      "channel": "native",
      "evidence_roles": [
        "native_electron"
      ],
      "location": "native-local-project-search.png",
      "media_type": "image/png",
      "sha256": "b3ea89c566dd2c11a74513b084400cbf7838e446fc4e063ee4a1b586ca592ef5",
      "produced_at": "2026-07-30T08:47:28Z"
    },
    {
      "artifact_id": "project-search-overview-screenshot",
      "kind": "screenshot",
      "channel": "native",
      "evidence_roles": [
        "native_electron"
      ],
      "location": "native-local-project-overview.png",
      "media_type": "image/png",
      "sha256": "b30874aa9223767eed90c3e7935f8b0ad2d4a4ab6a882ceee21b7820080cca23",
      "produced_at": "2026-07-30T08:47:28Z"
    }
  ],
  "evidence": {
    "build": {
      "status": "passed",
      "command": "make -C agi-stack desktop-check && make -C agi-stack desktop-browser-qa && node contracts/desktop-web-parity/generate-parity-manifest-v2.mjs --check",
      "started_at": "2026-07-30T08:28:00Z",
      "completed_at": "2026-07-30T08:36:20Z",
      "summary": "Clean detached HEAD passed sidecar, Desktop, Electron production build, Browser QA, and parity-manifest drift gates.",
      "artifact_ids": [
        "project-search-build-report"
      ]
    },
    "browser": {
      "status": "blocked",
      "command": "make -C agi-stack desktop-browser-qa",
      "started_at": "2026-07-30T08:34:35Z",
      "completed_at": "2026-07-30T08:36:20Z",
      "summary": "The Desktop Search fixture matrix passed, but Project Search matched-state Browser evidence was blocked by the absence of an authorized Cloud project session.",
      "artifact_ids": [
        "project-search-browser-blocker"
      ]
    },
    "native": {
      "status": "blocked",
      "command": "AGISTACK_DESKTOP_DEBUG_PORT=9333 make -C agi-stack run-desktop",
      "started_at": "2026-07-30T08:38:08Z",
      "completed_at": "2026-07-30T08:47:28Z",
      "summary": "Computer Use verified the Local native route, deep-link recovery, command-palette and Escape behavior, route history, sidecar degradation, and structured unavailable responses on the clean HEAD. Cloud native verification remained blocked because no authorized disposable Cloud session was available.",
      "artifact_ids": [
        "project-search-native-authority",
        "project-search-native-screenshot",
        "project-search-overview-screenshot"
      ]
    }
  }
}
